{
  "company_name": "NTPC Limited",
  "dataset_summary": {
    "row_count": 126,
    "columns": [
      "DATE",
      "SERIES",
      "OPEN",
      "HIGH",
      "LOW",
      "PREV. CLOSE",
      "LTP",
      "CLOSE",
      "VWAP",
      "52 WEEK HIGH",
      "52 WEEK LOW",
      "VOLUME",
      "VALUE",
      "NO. OF  TRADES"
    ],
    "date_coverage": null,
    "missing_information": [
      "Company identifier in row data",
      "Operational performance metrics beyond annual totals"
    ],
    "data_limitations": [
      "No recognized company or ticker identifier field; company coverage cannot be verified from rows.",
      "No source/document provenance fields identified."
    ]
  },
  "ranking_reliable": true,
  "ranking_limitation": null,
  "ranked_candidates": [
    {
      "candidate_id": "CAND_001_RENEWABLE_TRANSITION",
      "rank": 1,
      "category": "renewable_transition",
      "hypothesis": "NTPC's shift toward non-fossil fuel generation is primarily driven by subsidiary growth and capital allocation, but coal-based assets remain the dominant contributor to operating turnover, necessitating detailed monitoring of capital expenditure efficiency vs. generation mix targets.",
      "financial_importance": "High; NTPC's valuation and transition credibility depend on the scaling of renewable generation against coal-based revenue stability.",
      "metrics_and_periods": [
        "Revenue from non-fossil sources vs. total revenue (FY2024-25)",
        "Installed renewable capacity (GW) vs. 2032 targets (as of March 31, 2025)",
        "Revenue by energy source (Coal, Gas, Solar, Hydro, Wind)"
      ],
      "evidence_found": [
        {
          "statement": "Revenue from non-fossil energy sources reached 17,359.67 crore (9.33% of total revenue).",
          "source_type": "pdf",
          "source_url": null,
          "date": null,
          "row_identifier": "INE733E01010",
          "evidence_id": "ev_cc45cae4383a4d6afdc8f340",
          "status": "observed_in_ingested_source"
        },
        {
          "statement": "As of March 31, 2025, the NTPC Group has commissioned 6.8 GW of renewable energy capacity.",
          "source_type": "pdf",
          "source_url": null,
          "date": null,
          "row_identifier": "INE733E01010",
          "evidence_id": "ev_fed1ce3d68b30da9c8ece744",
          "status": "observed_in_ingested_source"
        }
      ],
      "additional_evidence_needed": [
        "Historical trend analysis of generation mix percentage (previous 3-5 years)",
        "Detailed breakdown of renewable capex by project stage (commissioned vs. under implementation) across all subsidiaries"
      ],
      "alternative_explanation": "Renewable energy growth may be hampered by infrastructure and regulatory delays, forcing NTPC to extend the operational life of its coal assets to ensure national energy security.",
      "falsification_condition": "If non-fossil revenue percentage fails to increase year-on-year, or if total renewable commissioning capacity stays stagnant despite the 2032 growth mandate.",
      "data_risks_and_limitations": [
        "Reported figures represent single point in time (FY2024-25).",
        "No independent verification of subsidiary-level operational performance."
      ],
      "scores": {
        "financial_significance": {
          "score": 5,
          "rationale": "Directly impacts investor sentiment regarding the ESG transition strategy."
        },
        "evidence_availability": {
          "score": 4,
          "rationale": "High-quality annual report data available for current fiscal year."
        },
        "testability": {
          "score": 4,
          "rationale": "Metrics are clearly defined in the integrated annual report."
        },
        "non_obviousness": {
          "score": 3,
          "rationale": "Balances short-term coal-dependence stability with long-term green capital mandates."
        },
        "cross_validation_potential": {
          "score": 4,
          "rationale": "Cross-validation possible with CERC regulatory filings and exchange disclosures."
        }
      },
      "weighted_score": 84.5,
      "weighted_score_rationale": "(5/5)*30 + (4/5)*25 + (4/5)*20 + (3/5)*7.5 + (4/5)*17.5 = 30 + 20 + 16 + 4.5 + 14 = 84.5 (adjusted to model schema formula logic: 30 + 20 + 16 + 4.5 + 14 = 84.5) [Weighted total recomputed by SignalForge weighted_score; original model response retained separately.]",
      "next_research_action": "Map year-over-year revenue generation mix from previous Integrated Annual Reports to establish the rate of transition."
    }
  ],
  "recommended_candidate_id": "CAND_001_RENEWABLE_TRANSITION"
}
