{
  "company_name": "NTPC Limited",
  "dataset_summary": {
    "row_count": 126,
    "columns": [
      "DATE",
      "SERIES",
      "OPEN",
      "HIGH",
      "LOW",
      "PREV. CLOSE",
      "LTP",
      "CLOSE",
      "VWAP",
      "52 WEEK HIGH",
      "52 WEEK LOW",
      "VOLUME",
      "VALUE",
      "NO. OF  TRADES"
    ],
    "date_coverage": null,
    "missing_information": [
      "Company-specific identifier in rows",
      "Financial data for trend analysis",
      "Operational generation volumes",
      "Asset-level capacity data"
    ],
    "data_limitations": [
      "No recognized company or ticker identifier field; company coverage cannot be verified from rows.",
      "The CSV dataset contains only market-level trading data with no identifiers linking to NTPC Ltd.",
      "Evidence is entirely derived from manually ingested Integrated Annual Report 2024-25 PDFs."
    ]
  },
  "ranking_reliable": true,
  "ranking_limitation": "The CSV dataset is entirely irrelevant to company performance analysis; all research relies on the verified annual report disclosures.",
  "ranked_candidates": [
    {
      "candidate_id": "renewable_transition_001",
      "rank": 1,
      "category": "renewable_transition",
      "hypothesis": "NTPC's aggressive renewable capacity expansion (target 60GW by 2032) represents a pivot that is heavily reliant on subsidiary-led vehicles and strategic joint ventures rather than direct parent-led organic growth.",
      "financial_importance": "The scale of transition (target 60GW) and the use of IPOs (e.g., NGEL IPO raising 10,000 Cr) significantly impact the company's long-term capital structure and valuation.",
      "metrics_and_periods": [
        "Commissioned RE capacity as of 31 March 2025 (6.8 GW)",
        "Capacity under execution (14.5 GW)",
        "Pipeline capacity (11 GW)",
        "NGEL IPO proceeds deployment"
      ],
      "evidence_found": [
        {
          "statement": "NTPC has set a target to achieve 60 GW of renewable energy capacity by 2032. As of March 31, 2025, NTPC Group has commissioned 6.8 GW of renewable energy capacity.",
          "source_type": "pdf",
          "source_url": null,
          "date": null,
          "row_identifier": null,
          "evidence_id": "ev_fed1ce3d68b30da9c8ece744",
          "status": "observed_in_ingested_source"
        },
        {
          "statement": "NGEL raised 10,000 crore through an IPO in November 2024 to bolster financial capacity for green projects.",
          "source_type": "pdf",
          "source_url": null,
          "date": null,
          "row_identifier": null,
          "evidence_id": "ev_d284dd5e0503ac55d73f2441",
          "status": "observed_in_ingested_source"
        }
      ],
      "additional_evidence_needed": [
        "Historical breakdown of RE vs Thermal generation revenue for the last 5 years to measure the speed of transition.",
        "Cost of capital metrics specifically for the renewable energy subsidiaries compared to parent.",
        "Detailed commissioning schedule for the 14.5 GW under execution."
      ],
      "alternative_explanation": "The transition may be slower than communicated due to regulatory, land acquisition, or grid connectivity bottlenecks, forcing reliance on JVs to spread risk rather than purely strategic growth.",
      "falsification_condition": "Failure to achieve the commissioned capacity targets (6.8 GW) or a reversal in the 60GW 2032 goal in future disclosures.",
      "data_risks_and_limitations": [
        "Reliance on management narrative and forward-looking statements.",
        "Commissioned capacity numbers include JVs; individual contribution levels are complex to audit."
      ],
      "scores": {
        "financial_significance": {
          "score": 5,
          "rationale": "High impact on long-term valuation and capital allocation."
        },
        "evidence_availability": {
          "score": 4,
          "rationale": "Strong data present in the 2024-25 Annual Report."
        },
        "testability": {
          "score": 4,
          "rationale": "Targets are specific and quantifiable."
        },
        "non_obviousness": {
          "score": 3,
          "rationale": "Understanding the reliance on JV structures for capacity growth adds depth to the surface-level reporting."
        },
        "cross_validation_potential": {
          "score": 4,
          "rationale": "Can be verified against exchange filings and public announcements."
        }
      },
      "weighted_score": 84.5,
      "weighted_score_rationale": "High score due to massive financial materiality, strong evidence availability, and clear, testable, and quantifiable progress metrics regarding the transition strategy.",
      "next_research_action": "Map the specific RE projects across subsidiaries (NGEL, NREL, THDC, NEEPCO) and assess capital flow effectiveness from the parent."
    }
  ],
  "recommended_candidate_id": "renewable_transition_001"
}
